{
  "phase": "decompose",
  "target_id": "MOD-DRSAM-DASHBOARD",
  "assessed_at": "2026-07-06T17:15:00.000Z",
  "review_ref": "cursor-impl-cycle/output/reports/decompose-MOD-DRSAM-DASHBOARD.review.json",
  "ok_to_advance": true,
  "rewrite_required": false,
  "decisions": [
    {
      "critique_id": "C-1",
      "severity": "defer",
      "resolution": "defer",
      "action_required": false,
      "deferred_to_item": "DASH-07-crisis-onboarding-services-overlays",
      "rationale": "CRISIS-01 canonical export at frontend/src/components/crisis/ is sound; DASH-07 duplicate target_files and full interior AC are an integration amendment (add depends_on CRISIS-01-crisis-support-reusable, mount-only AC-1) — same deferral as CRISIS triage C-1; fix at DASH implement wave, not decompose-blocking rewrite."
    },
    {
      "critique_id": "C-2",
      "severity": "defer",
      "resolution": "defer",
      "action_required": false,
      "deferred_to_item": "DASH-05-insights-and-path-cards",
      "rationale": "DASH-05 AC-3 names ai_RNbBHXSD and layout_notes cite bTIvC/bTIuw; expand ui_refs and DS-02 mount contract at DASH-05 implement from ir/slices/bTHDU____root.json — not a decompose item-boundary change."
    },
    {
      "critique_id": "C-3",
      "severity": "defer",
      "resolution": "defer",
      "action_required": false,
      "deferred_to_item": "DASH-06-chat-and-journal-previews",
      "rationale": "chat-preview-meta siblings ai_RNbBHXSQ/SR/SV/SX are discoverable from bTHDU____root.json; DASH-06 anchors parent chat card — expand ui_refs at implement per ui-fidelity rubric without rewriting item split."
    },
    {
      "critique_id": "C-4",
      "severity": "defer",
      "resolution": "defer",
      "action_required": false,
      "deferred_to_item": "DASH-07-crisis-onboarding-services-overlays",
      "rationale": "Services RG cell click (bTJDw→bTJEC) and DASH-03 micro-commitment navigation (bTJGe/bTJGk) are workflow AC polish; scope and anchors already own regions — add AC-4 clauses at DASH-03/07 implement, not decompose rewrite."
    },
    {
      "critique_id": "C-5",
      "severity": "defer",
      "resolution": "defer",
      "action_required": false,
      "rationale": "Missing explicit project/ and adapter out-of-scope one-liners is documentation polish; all seven items are frontend-only with Supabase client patterns. Append at implement kickoff per implementation-constraints — same pattern as JOURNAL/SHELL triage."
    }
  ],
  "summary": "Review ok (91% readiness, 0 blockers); prior DASH-05 chip fix verified. 0 fix_now, 5 defer, 0 accept. Advance decompose: amend DASH-07 CRISIS import at implement, expand DASH-05/06 ui_refs, add DASH-03/07 workflow ACs, out-of-scope clauses at kickoff."
}
