{
  "phase": "implement",
  "target_id": "API-06-ai-confidence-level-trigger",
  "assessed_at": "2026-07-08T12:42:00.000Z",
  "review_ref": "cursor-impl-cycle/output/reports/implement-API-06-ai-confidence-level-trigger.review.json",
  "ok_to_advance": true,
  "rewrite_required": false,
  "decisions": [
    { "critique_id": "C-1", "severity": "defer", "resolution": "defer", "action_required": false, "rationale": "Unit tests not in AC; functional checks pass; defer to test-hardening wave." },
    { "critique_id": "C-2", "severity": "defer", "resolution": "defer", "action_required": false, "rationale": "JSONB onboarding_data storage is intentional brownfield prototype pattern per AC-3." },
    { "critique_id": "C-3", "severity": "accept", "resolution": "accept", "action_required": false, "rationale": "pathsSessionApi hook after PATHS-07 session submit matches scoped AC-2/AC-3 client-side workaround." },
    { "critique_id": "C-4", "severity": "defer", "resolution": "defer", "action_required": false, "rationale": "Threshold grounding polish only; FV-1/AC-1 pass with ENUM-03 slug ordering." }
  ],
  "summary": "0 fix_now, 3 defer, 1 accept. Review ok=true at 100% coverage; advance allowed."
}
