{
  "phase": "implement",
  "target_id": "CHAT-06-chat-welcome-empty-state",
  "assessed_at": "2026-07-08T10:20:00.000Z",
  "review_ref": "cursor-impl-cycle/output/reports/implement-CHAT-06-chat-welcome-empty-state.review.json",
  "ok_to_advance": true,
  "rewrite_required": false,
  "decisions": [
    {
      "critique_id": "C-1",
      "severity": "defer",
      "resolution": "defer",
      "action_required": false,
      "rationale": "Disclaimer ai_RNbBHXce nesting inside ai_RNbBHXcL is hierarchy parity polish; visual order and copy are correct, all ACs pass. CHAT-03 depends on welcome panel mount behavior, not strict DOM nesting of disclaimer node."
    },
    {
      "critique_id": "C-2",
      "severity": "defer",
      "resolution": "defer",
      "action_required": false,
      "rationale": "Anchor vs Group element_type difference is intentional for tel/sms crisis hotline navigation; functional_ok passes FV-2. Defer strict element_type parity."
    },
    {
      "critique_id": "C-3",
      "severity": "defer",
      "resolution": "defer",
      "action_required": false,
      "rationale": "Missing data-style-ref on typography nodes is automated parity tooling gap only; bubbleStyle classes are applied. Low priority backlog."
    }
  ],
  "summary": "0 fix_now, 3 defer, 0 accept. Review passed at 100% coverage with functional_ok true. CHAT-03 panel mount can proceed."
}
