{
  "phase": "implement",
  "target_id": "SET-03-coaching-tab-and-save",
  "assessed_at": "2026-07-08T11:07:00.000Z",
  "review_ref": "cursor-impl-cycle/output/reports/implement-SET-03-coaching-tab-and-save.review.json",
  "ok_to_advance": true,
  "rewrite_required": false,
  "decisions": [],
  "summary": "Review passed at 100%."
}
